{
  "id": "playlist-genesis-gcb",
  "title": "Genesis Explained | GCB",
  "platform": "YouTube",
  "url": "",
  "description": "A structured Genesis study playlist within the Goldstonian Concordance Bible ecosystem.",
  "book_links": ["book-genesis"],
  "doctrine_links": ["mirror-water-fire"],
  "video_ids": []
}